mysql> select * from faculty;
+-------+-------------+--------+------------+------------+--------+------------+----------+
| FacNO | FacName     | Gender | DOB        | DOJ        | DeptNo | MobileNo   | deptname |
+-------+-------------+--------+------------+------------+--------+------------+----------+
| 3     | geetha      | F      | 1997-05-18 | 2009-07-14 | 219    | 9374567867 | ECE      |
| 4     | puvirasi    | F      | 1988-06-13 | 2006-03-15 | 134    | 9898957345 | EEE      |
| 5     | Babu        | M      | 1984-08-24 | 2003-11-02 | 345    | 9868352578 | CSE      |
| 6     | kanagathara | F      | 1976-09-12 | 2000-09-15 | 321    | 9889475859 | CSE      |
+-------+-------------+--------+------------+------------+--------+------------+----------+
4 rows in set (0.03 sec)

mysql> commit;
Query OK, 0 rows affected (0.00 sec)

mysql> delete from faculty where facno=3;
Query OK, 1 row affected (0.03 sec)

mysql> select * from faculty;
+-------+-------------+--------+------------+------------+--------+------------+----------+
| FacNO | FacName     | Gender | DOB        | DOJ        | DeptNo | MobileNo   | deptname |
+-------+-------------+--------+------------+------------+--------+------------+----------+
| 4     | puvirasi    | F      | 1988-06-13 | 2006-03-15 | 134    | 9898957345 | EEE      |
| 5     | Babu        | M      | 1984-08-24 | 2003-11-02 | 345    | 9868352578 | CSE      |
| 6     | kanagathara | F      | 1976-09-12 | 2000-09-15 | 321    | 9889475859 | CSE      |
+-------+-------------+--------+------------+------------+--------+------------+----------+
3 rows in set (0.02 sec)

mysql> rollback;
Query OK, 0 rows affected (0.00 sec)

mysql> select * from faculty;
+-------+-------------+--------+------------+------------+--------+------------+----------+
| FacNO | FacName     | Gender | DOB        | DOJ        | DeptNo | MobileNo   | deptname |
+-------+-------------+--------+------------+------------+--------+------------+----------+
| 4     | puvirasi    | F      | 1988-06-13 | 2006-03-15 | 134    | 9898957345 | EEE      |
| 5     | Babu        | M      | 1984-08-24 | 2003-11-02 | 345    | 9868352578 | CSE      |w
| 6     | kanagathara | F      | 1976-09-12 | 2000-09-15 | 321    | 9889475859 | CSE      |
+-------+-------------+--------+------------+------------+--------+------------+----------+
3 rows in set (0.00 sec)

mysql>